{"boundary_mode":"ANNOTATED","policy_hash":"blake3:7cfdb5f69860a31338e9a9f45aed228a3645cb3e2a6699401df0d9229871d677","prompt_payload_hash":"blake3:9680e18834ed82905325b6987387672578d8d7a504608c52cd4b4321d7edca9c","records":[{"admitted_boundary_modes":["ANNOTATED","TELEMETRY_ONLY"],"boundary_class":"TELEMETRY","emitted_value_hash":"blake3:0072e9748db7b3485d767d23db3a53dff8c0763cb735036b2f0e74492592a02a","policy_rule_id":"message_template.system_role","prompt_path":"messages[0].role","source_artifact_hash":"blake3:40f47b8e75d040d4585ac177ed7720556d5485064cfd602239b97970aab85adf","source_path":"template.messages[0].role","transformation_kind":"TEMPLATE"},{"admitted_boundary_modes":["ANNOTATED","TELEMETRY_ONLY"],"boundary_class":"TELEMETRY","emitted_value_hash":"blake3:73313136bcb102fdaf1ae6df8871aeef2f3ae47e0f699f4c145a196373d301e9","policy_rule_id":"system_prompt","prompt_path":"messages[0].content","source_artifact_hash":"blake3:fd92fbd05d1c36e00ff4137a1548520eeaa63e123bada3575f8ff2d16f773f5c","source_path":"system_prompt","transformation_kind":"TEMPLATE"},{"admitted_boundary_modes":["ANNOTATED","TELEMETRY_ONLY"],"boundary_class":"TELEMETRY","emitted_value_hash":"blake3:35c2f81898d7a6277c641be29cda7784c84f620151ffd44981360fac68632f18","policy_rule_id":"message_template.user_role","prompt_path":"messages[1].role","source_artifact_hash":"blake3:5f6d3989c7fb86d3c961c0b217cb3b4939cff7416ed8980a18c7e662ec3e0761","source_path":"template.messages[1].role","transformation_kind":"TEMPLATE"},{"admitted_boundary_modes":["ANNOTATED","TELEMETRY_ONLY"],"boundary_class":"TELEMETRY","emitted_value_hash":"blake3:907eddf57e6f6b5e094ba0b9e026a463a481a9eec77d6e4a7a8f8b5661c98f80","policy_rule_id":"allowed_keys[0]","prompt_path":"messages[1].content.family_id","source_artifact_hash":"blake3:7f1fda7875ce52060297be56ccde65cf7643d682e9b909d01f54f722da4fa2c9","source_path":"family_id","transformation_kind":"COPY"},{"admitted_boundary_modes":["ANNOTATED","TELEMETRY_ONLY"],"boundary_class":"TELEMETRY","emitted_value_hash":"blake3:9c9e356df6b71ee303118dd92b6aafae7d8e21049534fc38b78de9bc0a2c0d2a","policy_rule_id":"allowed_keys[1]","prompt_path":"messages[1].content.current_strategy","source_artifact_hash":"blake3:7f1fda7875ce52060297be56ccde65cf7643d682e9b909d01f54f722da4fa2c9","source_path":"current_strategy","transformation_kind":"COPY"},{"admitted_boundary_modes":["ANNOTATED","TELEMETRY_ONLY"],"boundary_class":"TELEMETRY","emitted_value_hash":"blake3:dbc68fe02b8f6dea243ca01aab621f792145da57adc033c6bc51f5c592256a1d","policy_rule_id":"allowed_keys[2]","prompt_path":"messages[1].content.allowed_toggles[0]","source_artifact_hash":"blake3:7f1fda7875ce52060297be56ccde65cf7643d682e9b909d01f54f722da4fa2c9","source_path":"allowed_toggles[0]","transformation_kind":"COPY"},{"admitted_boundary_modes":["ANNOTATED","TELEMETRY_ONLY"],"boundary_class":"TELEMETRY","emitted_value_hash":"blake3:9b1c55e9522e4771a5c56f986afa6f6b7d357f440adfaf3002a77cdbb99feecf","policy_rule_id":"allowed_keys[2]","prompt_path":"messages[1].content.allowed_toggles[1]","source_artifact_hash":"blake3:7f1fda7875ce52060297be56ccde65cf7643d682e9b909d01f54f722da4fa2c9","source_path":"allowed_toggles[1]","transformation_kind":"COPY"},{"admitted_boundary_modes":["ANNOTATED","TELEMETRY_ONLY"],"boundary_class":"TELEMETRY","emitted_value_hash":"blake3:e67a9c4536256f1ec7495a146b5442fa7c0ed99e258a08260a4a244fa31c7c61","policy_rule_id":"allowed_keys[3]","prompt_path":"messages[1].content.max_proposals","source_artifact_hash":"blake3:7f1fda7875ce52060297be56ccde65cf7643d682e9b909d01f54f722da4fa2c9","source_path":"max_proposals","transformation_kind":"COPY"},{"admitted_boundary_modes":["ANNOTATED","TELEMETRY_ONLY"],"boundary_class":"TELEMETRY","emitted_value_hash":"blake3:ea2a07b22d5069e25d6a6f7b5470e8976a47ef3189034a8ca96dba132a5ce7ae","policy_rule_id":"allowed_keys[4]","prompt_path":"messages[1].content.benchmark_summary.coverage","source_artifact_hash":"blake3:7f1fda7875ce52060297be56ccde65cf7643d682e9b909d01f54f722da4fa2c9","source_path":"benchmark_summary.coverage","transformation_kind":"COPY"},{"admitted_boundary_modes":["ANNOTATED","TELEMETRY_ONLY"],"boundary_class":"TELEMETRY","emitted_value_hash":"blake3:813e9b729141e7f385afa0a2d0df3e6c3789e427ffe4aeef566a565bc8f2fe3d","policy_rule_id":"allowed_keys[4]","prompt_path":"messages[1].content.benchmark_summary.open_failures","source_artifact_hash":"blake3:7f1fda7875ce52060297be56ccde65cf7643d682e9b909d01f54f722da4fa2c9","source_path":"benchmark_summary.open_failures","transformation_kind":"COPY"},{"admitted_boundary_modes":["ANNOTATED","TELEMETRY_ONLY"],"boundary_class":"TELEMETRY","emitted_value_hash":"blake3:d3d3fdd05806798aac44b2665ce15fe704356b20428157113d6b5f125d25bc60","policy_rule_id":"allowed_keys[4]","prompt_path":"messages[1].content.benchmark_summary.score","source_artifact_hash":"blake3:7f1fda7875ce52060297be56ccde65cf7643d682e9b909d01f54f722da4fa2c9","source_path":"benchmark_summary.score","transformation_kind":"COPY"},{"admitted_boundary_modes":["ANNOTATED","TELEMETRY_ONLY"],"boundary_class":"TELEMETRY","emitted_value_hash":"blake3:7c07db28d9ed47b7e7fd8c77c3c871217ddda54be41462607466bd9b6e2a4507","policy_rule_id":"allowed_keys[5]","prompt_path":"messages[1].content.unresolved_failure_fields[0]","source_artifact_hash":"blake3:7f1fda7875ce52060297be56ccde65cf7643d682e9b909d01f54f722da4fa2c9","source_path":"unresolved_failure_fields[0]","transformation_kind":"COPY"},{"admitted_boundary_modes":["ANNOTATED","TELEMETRY_ONLY"],"boundary_class":"TELEMETRY","emitted_value_hash":"blake3:21ad59c3a557d4b134b02ccd0312bfaf381112d73b422682a72d9545bcd45444","policy_rule_id":"allowed_keys[6]","prompt_path":"messages[1].content.recent_lineage_rows[0].field","source_artifact_hash":"blake3:7f1fda7875ce52060297be56ccde65cf7643d682e9b909d01f54f722da4fa2c9","source_path":"recent_lineage_rows[0].field","transformation_kind":"COPY"},{"admitted_boundary_modes":["ANNOTATED","TELEMETRY_ONLY"],"boundary_class":"TELEMETRY","emitted_value_hash":"blake3:fd3533c51eac1ca3f3f021762f58833aef44c03f81c76017eb3db3262a509bcb","policy_rule_id":"allowed_keys[6]","prompt_path":"messages[1].content.recent_lineage_rows[0].status","source_artifact_hash":"blake3:7f1fda7875ce52060297be56ccde65cf7643d682e9b909d01f54f722da4fa2c9","source_path":"recent_lineage_rows[0].status","transformation_kind":"COPY"},{"admitted_boundary_modes":["ANNOTATED","TELEMETRY_ONLY"],"boundary_class":"TELEMETRY","emitted_value_hash":"blake3:7c07db28d9ed47b7e7fd8c77c3c871217ddda54be41462607466bd9b6e2a4507","policy_rule_id":"allowed_keys[6]","prompt_path":"messages[1].content.recent_lineage_rows[1].field","source_artifact_hash":"blake3:7f1fda7875ce52060297be56ccde65cf7643d682e9b909d01f54f722da4fa2c9","source_path":"recent_lineage_rows[1].field","transformation_kind":"COPY"},{"admitted_boundary_modes":["ANNOTATED","TELEMETRY_ONLY"],"boundary_class":"TELEMETRY","emitted_value_hash":"blake3:a39e8f9375ca998e841f27a19907933bfe0f17fc9d133f6109c33cac2ed5561b","policy_rule_id":"allowed_keys[6]","prompt_path":"messages[1].content.recent_lineage_rows[1].status","source_artifact_hash":"blake3:7f1fda7875ce52060297be56ccde65cf7643d682e9b909d01f54f722da4fa2c9","source_path":"recent_lineage_rows[1].status","transformation_kind":"COPY"},{"admitted_boundary_modes":["ANNOTATED","TELEMETRY_ONLY"],"boundary_class":"TELEMETRY","emitted_value_hash":"blake3:5fb8432461e371c2f0ecf75db699d935b4048afceed698c8ba00d8a43cb2f1b8","policy_rule_id":"allowed_keys[7]","prompt_path":"messages[1].content.heuristic_reference.bundle_id","source_artifact_hash":"blake3:7f1fda7875ce52060297be56ccde65cf7643d682e9b909d01f54f722da4fa2c9","source_path":"heuristic_reference.bundle_id","transformation_kind":"COPY"},{"admitted_boundary_modes":["ANNOTATED","TELEMETRY_ONLY"],"boundary_class":"TELEMETRY","emitted_value_hash":"blake3:ee1e79ad3f1656168e36d88cafded16dc3968d6434dba8ae759dec0d1ba13291","policy_rule_id":"allowed_keys[7]","prompt_path":"messages[1].content.heuristic_reference.version","source_artifact_hash":"blake3:7f1fda7875ce52060297be56ccde65cf7643d682e9b909d01f54f722da4fa2c9","source_path":"heuristic_reference.version","transformation_kind":"COPY"},{"admitted_boundary_modes":["ANNOTATED"],"boundary_class":"DERIVED_TEXT","emitted_value_hash":"blake3:7fd5eb36a784795c4c915242a702e52739953f2356455a0cb790c51694e90060","policy_rule_id":"allowed_keys[8]","prompt_path":"messages[1].content.mutator_context.challenge_observation","source_artifact_hash":"blake3:7f1fda7875ce52060297be56ccde65cf7643d682e9b909d01f54f722da4fa2c9","source_path":"mutator_context.challenge_observation","transformation_kind":"DERIVED_ANNOTATION"},{"admitted_boundary_modes":["ANNOTATED"],"boundary_class":"DERIVED_TEXT","emitted_value_hash":"blake3:b4af622ba1e3faf5346faaa60027f5926d11381995f07c043e6c029fea977e9b","policy_rule_id":"allowed_keys[9]","prompt_path":"messages[1].content.mutator_context.challenge_profile.header_surfaces[0]","source_artifact_hash":"blake3:7f1fda7875ce52060297be56ccde65cf7643d682e9b909d01f54f722da4fa2c9","source_path":"mutator_context.challenge_profile.header_surfaces[0]","transformation_kind":"DERIVED_ANNOTATION"},{"admitted_boundary_modes":["ANNOTATED"],"boundary_class":"DERIVED_TEXT","emitted_value_hash":"blake3:3d4a004803cf335c455f8ecc8db10474a82f2b3544f6bf01a36156453bdc984d","policy_rule_id":"allowed_keys[10]","prompt_path":"messages[1].content.mutator_context.challenge_profile.layout_notes[0]","source_artifact_hash":"blake3:7f1fda7875ce52060297be56ccde65cf7643d682e9b909d01f54f722da4fa2c9","source_path":"mutator_context.challenge_profile.layout_notes[0]","transformation_kind":"DERIVED_ANNOTATION"}],"version":"airlock.v0"}