{"boundary_mode":"TELEMETRY_ONLY","policy_hash":"blake3:bccf2508420d83910bb57553eba079825d7fb6ce0bf76d4ad1deebc4e2d2710f","prompt_payload_hash":"blake3:1461e14b6ef014affc1923e128c698094052c0602856c8f3ffcb29fd8f1e069f","records":[{"admitted_boundary_modes":["ANNOTATED","TELEMETRY_ONLY"],"boundary_class":"TELEMETRY","emitted_value_hash":"blake3:0072e9748db7b3485d767d23db3a53dff8c0763cb735036b2f0e74492592a02a","policy_rule_id":"message_template.system_role","prompt_path":"messages[0].role","source_artifact_hash":"blake3:40f47b8e75d040d4585ac177ed7720556d5485064cfd602239b97970aab85adf","source_path":"template.messages[0].role","transformation_kind":"TEMPLATE"},{"admitted_boundary_modes":["ANNOTATED","TELEMETRY_ONLY"],"boundary_class":"TELEMETRY","emitted_value_hash":"blake3:acac26f4ad96394bff9d416a23df6524fa2fc5cc8946598a92acdbc9820c174d","policy_rule_id":"system_prompt","prompt_path":"messages[0].content","source_artifact_hash":"blake3:7b938e7f5e7db5daeca0d61f82144a130980f996c2f2e722cf7e381b25a0387f","source_path":"system_prompt","transformation_kind":"TEMPLATE"},{"admitted_boundary_modes":["ANNOTATED","TELEMETRY_ONLY"],"boundary_class":"TELEMETRY","emitted_value_hash":"blake3:35c2f81898d7a6277c641be29cda7784c84f620151ffd44981360fac68632f18","policy_rule_id":"message_template.user_role","prompt_path":"messages[1].role","source_artifact_hash":"blake3:5f6d3989c7fb86d3c961c0b217cb3b4939cff7416ed8980a18c7e662ec3e0761","source_path":"template.messages[1].role","transformation_kind":"TEMPLATE"},{"admitted_boundary_modes":["ANNOTATED","TELEMETRY_ONLY"],"boundary_class":"TELEMETRY","emitted_value_hash":"blake3:907eddf57e6f6b5e094ba0b9e026a463a481a9eec77d6e4a7a8f8b5661c98f80","policy_rule_id":"allowed_keys[0]","prompt_path":"messages[1].content.family_id","source_artifact_hash":"blake3:b2e21222698fd835177577f184dcc7d5d65384e5a89d3aab43376094a8c926f1","source_path":"family_id","transformation_kind":"COPY"},{"admitted_boundary_modes":["ANNOTATED","TELEMETRY_ONLY"],"boundary_class":"TELEMETRY","emitted_value_hash":"blake3:9c9e356df6b71ee303118dd92b6aafae7d8e21049534fc38b78de9bc0a2c0d2a","policy_rule_id":"allowed_keys[1]","prompt_path":"messages[1].content.current_strategy","source_artifact_hash":"blake3:b2e21222698fd835177577f184dcc7d5d65384e5a89d3aab43376094a8c926f1","source_path":"current_strategy","transformation_kind":"COPY"},{"admitted_boundary_modes":["ANNOTATED","TELEMETRY_ONLY"],"boundary_class":"TELEMETRY","emitted_value_hash":"blake3:dbc68fe02b8f6dea243ca01aab621f792145da57adc033c6bc51f5c592256a1d","policy_rule_id":"allowed_keys[2]","prompt_path":"messages[1].content.allowed_toggles[0]","source_artifact_hash":"blake3:b2e21222698fd835177577f184dcc7d5d65384e5a89d3aab43376094a8c926f1","source_path":"allowed_toggles[0]","transformation_kind":"COPY"},{"admitted_boundary_modes":["ANNOTATED","TELEMETRY_ONLY"],"boundary_class":"TELEMETRY","emitted_value_hash":"blake3:9b1c55e9522e4771a5c56f986afa6f6b7d357f440adfaf3002a77cdbb99feecf","policy_rule_id":"allowed_keys[2]","prompt_path":"messages[1].content.allowed_toggles[1]","source_artifact_hash":"blake3:b2e21222698fd835177577f184dcc7d5d65384e5a89d3aab43376094a8c926f1","source_path":"allowed_toggles[1]","transformation_kind":"COPY"},{"admitted_boundary_modes":["ANNOTATED","TELEMETRY_ONLY"],"boundary_class":"TELEMETRY","emitted_value_hash":"blake3:58d6fd3dc609068615d66b6a2616cce521e6bd49bbcd7854e3f2573b142c6637","policy_rule_id":"allowed_keys[3]","prompt_path":"messages[1].content.max_proposals","source_artifact_hash":"blake3:b2e21222698fd835177577f184dcc7d5d65384e5a89d3aab43376094a8c926f1","source_path":"max_proposals","transformation_kind":"COPY"},{"admitted_boundary_modes":["ANNOTATED","TELEMETRY_ONLY"],"boundary_class":"TELEMETRY","emitted_value_hash":"blake3:7387eaf8bc7eb60c8eb909cd86d2f12ce94057cd8a03962130616c6e96c4cf0f","policy_rule_id":"allowed_keys[4]","prompt_path":"messages[1].content.benchmark_summary.coverage","source_artifact_hash":"blake3:b2e21222698fd835177577f184dcc7d5d65384e5a89d3aab43376094a8c926f1","source_path":"benchmark_summary.coverage","transformation_kind":"COPY"},{"admitted_boundary_modes":["ANNOTATED","TELEMETRY_ONLY"],"boundary_class":"TELEMETRY","emitted_value_hash":"blake3:4d067153ac729a4a7e8220c97935ffba67487860d58298ceeb23864369867d9f","policy_rule_id":"allowed_keys[4]","prompt_path":"messages[1].content.benchmark_summary.open_failures","source_artifact_hash":"blake3:b2e21222698fd835177577f184dcc7d5d65384e5a89d3aab43376094a8c926f1","source_path":"benchmark_summary.open_failures","transformation_kind":"COPY"},{"admitted_boundary_modes":["ANNOTATED","TELEMETRY_ONLY"],"boundary_class":"TELEMETRY","emitted_value_hash":"blake3:d7273d8fc2971d946582788d4adea5dd60d3d3ebf74e74d867e27b2a43926b37","policy_rule_id":"allowed_keys[4]","prompt_path":"messages[1].content.benchmark_summary.score","source_artifact_hash":"blake3:b2e21222698fd835177577f184dcc7d5d65384e5a89d3aab43376094a8c926f1","source_path":"benchmark_summary.score","transformation_kind":"COPY"},{"admitted_boundary_modes":["ANNOTATED","TELEMETRY_ONLY"],"boundary_class":"TELEMETRY","emitted_value_hash":"blake3:d53d18c23212ea7b6300594bb89bce60218f6eff2b9d628b8cc42d3e79bbd5ab","policy_rule_id":"allowed_keys[5]","prompt_path":"messages[1].content.unresolved_failure_fields","source_artifact_hash":"blake3:b2e21222698fd835177577f184dcc7d5d65384e5a89d3aab43376094a8c926f1","source_path":"unresolved_failure_fields","transformation_kind":"COPY"},{"admitted_boundary_modes":["ANNOTATED","TELEMETRY_ONLY"],"boundary_class":"TELEMETRY","emitted_value_hash":"blake3:21ad59c3a557d4b134b02ccd0312bfaf381112d73b422682a72d9545bcd45444","policy_rule_id":"allowed_keys[6]","prompt_path":"messages[1].content.recent_lineage_rows[0].field","source_artifact_hash":"blake3:b2e21222698fd835177577f184dcc7d5d65384e5a89d3aab43376094a8c926f1","source_path":"recent_lineage_rows[0].field","transformation_kind":"COPY"},{"admitted_boundary_modes":["ANNOTATED","TELEMETRY_ONLY"],"boundary_class":"TELEMETRY","emitted_value_hash":"blake3:fd3533c51eac1ca3f3f021762f58833aef44c03f81c76017eb3db3262a509bcb","policy_rule_id":"allowed_keys[6]","prompt_path":"messages[1].content.recent_lineage_rows[0].status","source_artifact_hash":"blake3:b2e21222698fd835177577f184dcc7d5d65384e5a89d3aab43376094a8c926f1","source_path":"recent_lineage_rows[0].status","transformation_kind":"COPY"},{"admitted_boundary_modes":["ANNOTATED","TELEMETRY_ONLY"],"boundary_class":"TELEMETRY","emitted_value_hash":"blake3:dab8b37b667f9ba22eecfcace1ac1c5d0783d95f8829c0ee7dc96be27f8f7112","policy_rule_id":"allowed_keys[6]","prompt_path":"messages[1].content.recent_lineage_rows[1].field","source_artifact_hash":"blake3:b2e21222698fd835177577f184dcc7d5d65384e5a89d3aab43376094a8c926f1","source_path":"recent_lineage_rows[1].field","transformation_kind":"COPY"},{"admitted_boundary_modes":["ANNOTATED","TELEMETRY_ONLY"],"boundary_class":"TELEMETRY","emitted_value_hash":"blake3:a39e8f9375ca998e841f27a19907933bfe0f17fc9d133f6109c33cac2ed5561b","policy_rule_id":"allowed_keys[6]","prompt_path":"messages[1].content.recent_lineage_rows[1].status","source_artifact_hash":"blake3:b2e21222698fd835177577f184dcc7d5d65384e5a89d3aab43376094a8c926f1","source_path":"recent_lineage_rows[1].status","transformation_kind":"COPY"},{"admitted_boundary_modes":["ANNOTATED","TELEMETRY_ONLY"],"boundary_class":"TELEMETRY","emitted_value_hash":"blake3:5fb8432461e371c2f0ecf75db699d935b4048afceed698c8ba00d8a43cb2f1b8","policy_rule_id":"allowed_keys[7]","prompt_path":"messages[1].content.heuristic_reference.bundle_id","source_artifact_hash":"blake3:b2e21222698fd835177577f184dcc7d5d65384e5a89d3aab43376094a8c926f1","source_path":"heuristic_reference.bundle_id","transformation_kind":"COPY"},{"admitted_boundary_modes":["ANNOTATED","TELEMETRY_ONLY"],"boundary_class":"TELEMETRY","emitted_value_hash":"blake3:3d0aa561c8b36e3a8579921b8bc5d8a5d6c5e1787ab993c2aec131fc2b44b97d","policy_rule_id":"allowed_keys[7]","prompt_path":"messages[1].content.heuristic_reference.version","source_artifact_hash":"blake3:b2e21222698fd835177577f184dcc7d5d65384e5a89d3aab43376094a8c926f1","source_path":"heuristic_reference.version","transformation_kind":"COPY"}],"version":"airlock.v0"}